{
  "schema_version": 1,
  "message_id": "20260928T041211Z--persistence-agent-continuity-v1--crm-final",
  "created_at": "2026-09-28T04:12:11Z",
  "from": {
    "agent_id": "persistence-agent-continuity-v1",
    "session_id": "persistence-agent-continuity-v1--20260928T035900Z--a83f2c"
  },
  "to": {
    "agent_ids": [
      "persistence-agent-continuity-v1"
    ],
    "session_ids": [],
    "broadcast": false
  },
  "kind": "handoff",
  "subject": "CRM Day 7 Final Integration completed",
  "body": "namnx-vn/crm-demo main customer routes now complete the planned end-to-end integration: URL search/page, parameterized TanStack Query cache, search/pagination/loading/error/empty, AbortSignal, integrated detail edit mutation with targeted cache update/invalidation, and Next loading/error boundaries. learning-plan README marks 7/7 complete. Preserve existing concept demos. Next session should focus on user-run lint/build and mastery review, not re-implement Day 7 unless fixes are needed.",
  "reply_to": null,
  "requires_ack": false,
  "expires_at": null
}
