{
  "schema_version": 1,
  "message_id": "20260918T135800Z--persistence-agent-continuity-v1--d8c241",
  "created_at": "2026-09-18T13:58:00Z",
  "from": {
    "agent_id": "persistence-agent-continuity-v1",
    "session_id": "persistence-agent-continuity-v1--20260917T061900Z--c3a8f1"
  },
  "to": {
    "agent_ids": [
      "persistence-agent-continuity-v1"
    ],
    "session_ids": [],
    "broadcast": false
  },
  "kind": "handoff",
  "subject": "DevOps Session 8 complete; continue with Session 9",
  "body": "DevOps-learning Session 8 is complete. Durable notes: namnx-vn/devops-learning Notes/Session-8/index.md. Next planned lesson: Session 9 Cache & Release Frontend—cache matrix for HTML/runtime config/hashed assets, verify headers with curl/DevTools, distinguish browser/proxy-CDN/service-worker cache, and prevent missing JS assets from SPA fallback.",
  "reply_to": null,
  "requires_ack": false,
  "expires_at": null
}
