{
  "schema_version": 1,
  "message_id": "20261022T035733Z--persistence-agent-continuity-v1--p22audit",
  "created_at": "2026-10-22T03:57:33.370Z",
  "from": {
    "agent_id": "persistence-agent-continuity-v1",
    "session_id": "persistence-agent-continuity-v1--20261022T035348Z--b7e26c"
  },
  "to": {
    "agent_ids": [
      "persistence-agent-continuity-v1"
    ],
    "session_ids": [],
    "broadcast": false
  },
  "kind": "handoff",
  "subject": "Robotis Lab P2.2 read-only review: contact check is next gate",
  "body": "Audited robotis-lab master 5764732 and GitHub CI. Native 5/5 undisturbed stand pass run 39713341628; 99 offline tests, 8/8 native free body offset-force probe run 39713137894. Pilot pitch+ 0.10N/0.112s remained under 0.008rad (baseline .00012, PID .00016) and INCONCLUSIVE; P2.2 NOT_ACCEPTED, P3 BLOCKED. PR#9 documentation draft still open. Smallest next operator task is Webots R2025a GUI foot-contact/no anchoring verification with 32s baseline and screenshot/log evidence before considering bounded 0.15N pitch+ pair after safety review. No source/hardware changes made.",
  "reply_to": null,
  "requires_ack": false,
  "expires_at": null
}
