{
  "schema_version": 1,
  "message_id": "20261021T180613Z--persistence-agent-continuity-v1--rlh25-night",
  "created_at": "2026-10-21T18:06:13.320Z",
  "from": {
    "agent_id": "persistence-agent-continuity-v1",
    "session_id": "persistence-agent-continuity-v1--20261021T180127Z--98a547"
  },
  "to": {
    "agent_ids": [
      "persistence-agent-continuity-v1"
    ],
    "session_ids": [],
    "broadcast": false
  },
  "kind": "handoff",
  "subject": "Robotis Lab overnight CI autonomous task, P2 force still INCONCLUSIVE",
  "body": "Read master docs/OPERATOR_HANDOFF.md and projects/robotis-lab/brief.md. Owner authorized hourly simulation GitHub iteration until 2026-10-23 07:00 ICT; one enabled automation handles bounded cycles. Merged PR#4 to master 99b2444d...; 3/3 checks passed. Pilot artifact 39648900940: force 0.1N/0.112s applied7 steps, peak tilt only baseline .00011, PID .00014 (<.008), INCONCLUSIVE; next calibrate real meaningful controlled force/torque without relaxing tilt safety. Don't certify P2 or proceed to P3. Write subsequent findings into docs/OPERATOR_HANDOFF.md, never hardware.",
  "reply_to": null,
  "requires_ack": false,
  "expires_at": null
}
