{
  "schema_version": 1,
  "message_id": "20260928T040800Z--persistence-agent-continuity-v1--crm-plan-review",
  "created_at": "2026-09-28T04:08:00Z",
  "from": {
    "agent_id": "persistence-agent-continuity-v1",
    "session_id": "persistence-agent-continuity-v1--20260928T035900Z--a83f2c"
  },
  "to": {
    "agent_ids": ["persistence-agent-continuity-v1"],
    "session_ids": [],
    "broadcast": false
  },
  "kind": "handoff",
  "subject": "CRM plan review: Day 7 still incomplete",
  "body": "Reviewed namnx-vn/crm-demo current master. Core concepts/demos are largely present, but the main Day 7 CRM integration is not complete. Remaining primary-route work: /customers search + pagination backed by URL searchParams, query keys containing search/page, empty state and route loading/error boundaries; /customers/[id] integrated edit form + mutation + relevant cache refresh. Zustand selection is integrated and customer detail links work. Next session should implement Day 7 before marking the overall plan done.",
  "reply_to": null,
  "requires_ack": false,
  "expires_at": null
}
