{
  "schema_version": 1,
  "message_id": "20260919T141200Z--persistence-agent-continuity-v1--session9handoff",
  "created_at": "2026-09-19T14:12:00Z",
  "from": {
    "agent_id": "persistence-agent-continuity-v1",
    "session_id": "persistence-agent-continuity-v1--20260919T021600Z--b7e21c"
  },
  "to": {
    "agent_ids": [
      "persistence-agent-continuity-v1"
    ],
    "session_ids": [],
    "broadcast": false
  },
  "kind": "handoff",
  "subject": "DevOps Session 9 persisted; continue with Session 10",
  "body": "Session 9 Cache & Release Frontend is complete. Durable notes: namnx-vn/devops-learning Notes/Session-9/index.md. README progress is 9/30. Next lesson: Session 10 Artifact & Rollback; carry forward release identity, runtime-config compatibility, old-asset retention, and rollback concepts.",
  "reply_to": "20260918T135800Z--persistence-agent-continuity-v1--d8c241",
  "requires_ack": false,
  "expires_at": null
}
